{"blocking":false,"core_complete":true,"counts":{"by_status":{"EMITTED":1,"HELD":0,"IR_ONLY":1,"REJECTED":0,"UNSUPPORTED":1},"by_table":{"morpheme_compositions":{"EMITTED":0,"HELD":0,"IR_ONLY":0,"REJECTED":0,"UNSUPPORTED":1},"morphemes_atomic":{"EMITTED":1,"HELD":0,"IR_ONLY":0,"REJECTED":0,"UNSUPPORTED":0},"source_manifest":{"EMITTED":0,"HELD":0,"IR_ONLY":1,"REJECTED":0,"UNSUPPORTED":0}}},"diagnostics":[],"entries":[{"blocking":false,"explanation":"Composition semantics are outside the current core SKOS compiler scope and remain explicit non-core debt.","key":"comp-1","reason_code":"NON_CORE_COMPOSITION_SEMANTICS","related_reason_codes":["NON_CORE_COMPOSITION_SEMANTICS"],"semantic_iri":null,"semantic_key":[],"source_loci":["source:official-grammar"],"source_refs":[{"key":"official-grammar","table":"source_manifest"}],"status":"UNSUPPORTED","table":"morpheme_compositions"},{"blocking":false,"explanation":"The source record contributed to a successfully emitted core semantic resource.","key":"m1","reason_code":"EMITTED_CORE_SKOS","related_reason_codes":["EMITTED_CORE_SKOS"],"semantic_iri":"https://github.com/Entif-AI/Bilqis-MLX/id/grammar/CAT/VALUE","semantic_key":["CAT","VALUE"],"source_loci":["anchor:anchor-42","line:42","section:sec-1","source:official-grammar","table:table-1"],"source_refs":[{"key":"official-grammar","table":"source_manifest"},{"key":"sec-1","table":"source_sections"},{"key":"table-1","table":"source_tables"}],"status":"EMITTED","table":"morphemes_atomic"},{"blocking":false,"explanation":"The record is supporting source/provenance IR and has no standalone semantic resource in this compiler stage.","key":"official-grammar","reason_code":"IR_ONLY_SUPPORT","related_reason_codes":["IR_ONLY_SUPPORT"],"semantic_iri":null,"semantic_key":[],"source_loci":["source:official-grammar"],"source_refs":[{"key":"official-grammar","table":"source_manifest"}],"status":"IR_ONLY","table":"source_manifest"}],"group_issues":[],"manifest_version":"bilqis.skos.compiler-input/test-v1","profile_digest":"sha256:0123456789abcdef","profile_version":"bilqis.skos-profile/test-v1","release_ineligible":true,"schema_version":"bilqis.skos.held-ledger/v1","whole_release_eligible":false}
